original_sentence,processed_tokens
"HTML, CSS, Django, MongoDB",html css django mongodp
"React, JavaScript, Linux, Docker, CSS",react javascript linux docker css
"ASP.NET, Java, HTML, C#, C#",aspnet jav html
"ASP.NET, Next.js, Azure, JavaScript, Git",aspnet nextjs azure javascript git
"Java, Django, Kubernetes",jav django kubernetes
"Python, SQL, CSS",python sql css
"C#, Next.js, React, Docker",nextjs react docker
"MongoDB, Java, Node.js",mongodp jav nodejs
"CSS, Next.js, Flutter, SQL",css nextjs flutter sql
"Flask, C#, Django, Git",flask django git
"ASP.NET, Azure, Node.js, Flutter",aspnet azure nodejs flutter
"React, ASP.NET, MongoDB, Kubernetes",react aspnet mongodp kubernetes
"SQL, CSS, Python, Python, Next.js, JavaScript",sql css python python nextjs javascript
"Django, Node.js, ASP.NET, Flutter, Next.js, C#",django nodejs aspnet flutter nextjs
"ASP.NET, Flask, Java, Java",aspnet flask jav jav
"Next.js, Linux, MongoDB, JavaScript, Linux, React",nextjs linux mongodp javascript linux react
"Azure, JavaScript, HTML, Linux",azure javascript html linux
"Django, Next.js, Docker",django nextjs docker
"Linux, Java, Python, CSS, Docker, Flutter",linux jav python css docker flutter
"SQL, Flask, Python, MongoDB, HTML, Next.js",sql flask python mongodp html nextjs
"Python, MongoDB, MongoDB",python mongodp mongodp
"ASP.NET, HTML, C#, SQL, JavaScript",aspnet html sql javascript
"Azure, Next.js, Git",azure nextjs git
"SQL, Java, Azure",sql jav azure
"HTML, Git, Linux, React, HTML, Git",html git linux react html git
"Docker, CSS, Next.js, JavaScript, C#, SQL",docker css nextjs javascript sql
"CSS, MongoDB, SQL, HTML, MongoDB, Kubernetes",css mongodp sql html mongodp kubernetes
"C#, Flask, Flask, JavaScript",flask flask javascript
"Node.js, SQL, HTML",nodejs sql html
"HTML, MongoDB, ASP.NET",html mongodp aspnet
"Docker, Azure, JavaScript, MongoDB, CSS, SQL",docker azure javascript mongodp css sql
"Node.js, Next.js, Python",nodejs nextjs python
"JavaScript, Docker, Docker, C#, Linux, Kubernetes",javascript docker docker linux kubernetes
"Next.js, Python, Next.js, ASP.NET",nextjs python nextjs aspnet
"Flask, Docker, Java, CSS",flask docker jav css
"Docker, HTML, MongoDB, Flask, Java, C#",docker html mongodp flask jav
"C#, Kubernetes, MongoDB",kubernetes mongodp
"ASP.NET, Linux, Flask",aspnet linux flask
"Next.js, Python, Git, React, Flutter, Flask",nextjs python git react flutter flask
"Docker, Django, JavaScript, Next.js, Flutter, Docker",docker django javascript nextjs flutter docker
"Node.js, Azure, Django, Python, SQL",nodejs azure django python sql
"ASP.NET, Git, Git, C#",aspnet git git
"CSS, CSS, Azure, Docker",css css azure docker
"Python, Azure, Git, Git, Next.js, MongoDB",python azure git git nextjs mongodp
"ASP.NET, Linux, JavaScript, Python, Docker",aspnet linux javascript python docker
"Azure, Kubernetes, C#",azure kubernetes
"CSS, Node.js, C#, Python",css nodejs python
"JavaScript, ASP.NET, JavaScript, Docker",javascript aspnet javascript docker
"Linux, Python, Flutter, Java, React",linux python flutter jav react
"Docker, React, JavaScript",docker react javascript
"Node.js, JavaScript, React, Flutter, Next.js",nodejs javascript react flutter nextjs
"Java, React, Git, Flutter, HTML",jav react git flutter html
"Django, Django, Django",django django django
"JavaScript, Linux, Docker, Java",javascript linux docker jav
"Flutter, Flask, HTML, HTML, Node.js",flutter flask html html nodejs
"C#, Git, Kubernetes, Kubernetes",git kubernetes kubernetes
"Flutter, HTML, ASP.NET, MongoDB",flutter html aspnet mongodp
"Docker, Git, Next.js, Node.js",docker git nextjs nodejs
"Django, Azure, JavaScript",django azure javascript
"HTML, Kubernetes, ASP.NET, Kubernetes",html kubernetes aspnet kubernetes
"React, CSS, React",react css react
"C#, C#, ASP.NET, JavaScript, HTML",aspnet javascript html
"CSS, Flutter, Node.js, Docker, SQL",css flutter nodejs docker sql
"JavaScript, Flutter, Kubernetes, CSS, ASP.NET",javascript flutter kubernetes css aspnet
"Python, Flask, JavaScript, SQL",python flask javascript sql
"React, MongoDB, Node.js, Kubernetes, Linux, ASP.NET",react mongodp nodejs kubernetes linux aspnet
"Flask, CSS, Django, Next.js, JavaScript",flask css django nextjs javascript
"Kubernetes, Node.js, MongoDB, Docker, Flask",kubernetes nodejs mongodp docker flask
"Flask, Next.js, Node.js, Java, MongoDB",flask nextjs nodejs jav mongodp
"Java, CSS, Python, ASP.NET, Flutter",jav css python aspnet flutter
"SQL, React, Docker, Next.js, Node.js",sql react docker nextjs nodejs
"SQL, Flask, Kubernetes, CSS, Flutter",sql flask kubernetes css flutter
"Python, Azure, JavaScript, Java",python azure javascript jav
"Java, Django, Python, Flask, Linux, HTML",jav django python flask linux html
"Java, MongoDB, Java, CSS",jav mongodp jav css
"Docker, Flask, Docker, Java",docker flask docker jav
"SQL, Python, Flask, SQL, Python, Azure",sql python flask sql python azure
"MongoDB, ASP.NET, ASP.NET, Flutter, CSS",mongodp aspnet aspnet flutter css
"Azure, Kubernetes, JavaScript, Docker",azure kubernetes javascript docker
"ASP.NET, C#, HTML, C#",aspnet html
"SQL, Kubernetes, Java, Flask, Git, Java",sql kubernetes jav flask git jav
"C#, Kubernetes, Git, ASP.NET, Flask, CSS",kubernetes git aspnet flask css
"React, MongoDB, Python",react mongodp python
"MongoDB, Git, Linux, Python, React",mongodp git linux python react
"Python, Azure, JavaScript, Git, HTML",python azure javascript git html
"Flutter, Git, Azure, Django, Flask, Kubernetes",flutter git azure django flask kubernetes
"Django, CSS, CSS",django css css
"Java, Linux, Kubernetes, Java, Java, Azure",jav linux kubernetes jav jav azure
"Kubernetes, React, Next.js, Python, Python, Git",kubernetes react nextjs python python git
"Python, Django, Flutter, JavaScript, Django, ASP.NET",python django flutter javascript django aspnet
"Flask, Git, ASP.NET, Java",flask git aspnet jav
"C#, Kubernetes, HTML",kubernetes html
"Docker, CSS, Flask, Python",docker css flask python
"Django, MongoDB, MongoDB, Kubernetes, CSS, Linux",django mongodp mongodp kubernetes css linux
"Java, Docker, Python, Node.js",jav docker python nodejs
"Node.js, Flask, Django, Docker, Kubernetes, Azure",nodejs flask django docker kubernetes azure
"Node.js, ASP.NET, Kubernetes",nodejs aspnet kubernetes
"Docker, Linux, HTML, Node.js, Flask",docker linux html nodejs flask
"HTML, Linux, Docker, Azure",html linux docker azure
"React, React, ASP.NET",react react aspnet
"Node.js, Next.js, C#",nodejs nextjs
"Node.js, Flutter, Java, Java, MongoDB",nodejs flutter jav jav mongodp
"Node.js, Flask, Node.js",nodejs flask nodejs
"Node.js, ASP.NET, Java, Java",nodejs aspnet jav jav
"Node.js, Azure, Next.js, C#, Kubernetes",nodejs azure nextjs kubernetes
"ASP.NET, Java, JavaScript, SQL",aspnet jav javascript sql
"CSS, C#, Node.js, Azure, MongoDB, Django",css nodejs azure mongodp django
"CSS, Kubernetes, Node.js, Node.js, Kubernetes",css kubernetes nodejs nodejs kubernetes
"HTML, JavaScript, MongoDB, Kubernetes",html javascript mongodp kubernetes
"C#, Linux, Docker, CSS",linux docker css
"CSS, Java, C#",css jav
"Flask, C#, React",flask react
"HTML, CSS, Azure, Linux, Next.js, Next.js",html css azure linux nextjs nextjs
"CSS, Linux, ASP.NET, Azure, Azure, SQL",css linux aspnet azure azure sql
"Flask, Linux, Linux, Java",flask linux linux jav
"JavaScript, Docker, MongoDB, Django, C#, Flask",javascript docker mongodp django flask
"Next.js, Django, Git, Linux, Flutter",nextjs django git linux flutter
"HTML, Docker, HTML, Kubernetes, Docker, HTML",html docker html kubernetes docker html
"Python, ASP.NET, Node.js, Java",python aspnet nodejs jav
"HTML, Flutter, SQL, Django, ASP.NET",html flutter sql django aspnet
"Flutter, Linux, SQL, Git, Azure",flutter linux sql git azure
"Java, Git, Django, MongoDB",jav git django mongodp
"ASP.NET, HTML, React, JavaScript, Flask",aspnet html react javascript flask
"Flask, Kubernetes, Django, Kubernetes, MongoDB",flask kubernetes django kubernetes mongodp
"Django, Git, JavaScript, Azure, Django, Python",django git javascript azure django python
"Next.js, Kubernetes, Docker, Django, CSS, SQL",nextjs kubernetes docker django css sql
"Next.js, Azure, Django, Node.js",nextjs azure django nodejs
"JavaScript, SQL, Java, SQL",javascript sql jav sql
"Django, React, Azure, Linux, Flutter",django react azure linux flutter
"Azure, Node.js, HTML, Git, Git, JavaScript",azure nodejs html git git javascript
"Java, Linux, Next.js, Git, Linux",jav linux nextjs git linux
"Next.js, CSS, Django, JavaScript",nextjs css django javascript
"Next.js, Azure, Linux",nextjs azure linux
"Flask, Flask, HTML, Azure, Flutter",flask flask html azure flutter
"Linux, ASP.NET, SQL",linux aspnet sql
"Next.js, Flask, Python",nextjs flask python
"Node.js, C#, Node.js, Linux, Flask, React",nodejs nodejs linux flask react
"Docker, C#, Linux",docker linux
"ASP.NET, Docker, Linux, Next.js, JavaScript",aspnet docker linux nextjs javascript
"Python, Flutter, Flask",python flutter flask
"Azure, React, Docker, Flutter, SQL, Flutter",azure react docker flutter sql flutter
"ASP.NET, Docker, Flutter, Linux",aspnet docker flutter linux
"CSS, Git, HTML, JavaScript",css git html javascript
"JavaScript, Django, Python, Next.js",javascript django python nextjs
"Next.js, Docker, HTML, Next.js",nextjs docker html nextjs
"Node.js, React, Django",nodejs react django
"Kubernetes, Java, Linux, Flutter, React, Azure",kubernetes jav linux flutter react azure
"Node.js, Node.js, Flutter, React, Linux, Flask",nodejs nodejs flutter react linux flask
"MongoDB, Next.js, HTML",mongodp nextjs html
"Node.js, Azure, Kubernetes, Flutter, Git",nodejs azure kubernetes flutter git
"Docker, Java, Kubernetes, C#, CSS, Flutter",docker jav kubernetes css flutter
"HTML, CSS, ASP.NET",html css aspnet
"Next.js, HTML, Docker",nextjs html docker
"HTML, Flask, C#, MongoDB, MongoDB",html flask mongodp mongodp
"ASP.NET, Flask, Flutter, Kubernetes",aspnet flask flutter kubernetes
"MongoDB, Linux, Docker, C#",mongodp linux docker
"React, CSS, MongoDB, C#, MongoDB, HTML",react css mongodp mongodp html
"Java, Django, Next.js",jav django nextjs
"Node.js, HTML, React, CSS",nodejs html react css
"React, C#, Azure, Azure, CSS",react azure azure css
"HTML, JavaScript, Django, Flutter",html javascript django flutter
"Python, C#, Next.js, JavaScript, Git, ASP.NET",python nextjs javascript git aspnet
"MongoDB, Java, Flutter, MongoDB",mongodp jav flutter mongodp
"CSS, CSS, Flutter",css css flutter
"Docker, React, Next.js, HTML, Django",docker react nextjs html django
"Azure, SQL, Java, Django, ASP.NET, Flutter",azure sql jav django aspnet flutter
"React, JavaScript, Git, C#, JavaScript, MongoDB",react javascript git javascript mongodp
"C#, Java, MongoDB, Flutter",jav mongodp flutter
"Flask, Java, Python, Django, SQL",flask jav python django sql
"Flutter, Flask, Azure, ASP.NET, SQL, SQL",flutter flask azure aspnet sql sql
"Node.js, ASP.NET, Flutter",nodejs aspnet flutter
"Docker, Git, ASP.NET, Flask, Git, Flutter",docker git aspnet flask git flutter
"ASP.NET, Docker, Node.js, JavaScript, Git",aspnet docker nodejs javascript git
"Docker, Docker, SQL",docker docker sql
"Django, Node.js, Git, Flutter, C#",django nodejs git flutter
"Python, Next.js, SQL, Kubernetes, Next.js, Azure",python nextjs sql kubernetes nextjs azure
"Docker, HTML, Next.js",docker html nextjs
"HTML, CSS, CSS",html css css
"React, Docker, Docker, Java, JavaScript, MongoDB",react docker docker jav javascript mongodp
"HTML, HTML, Node.js, Linux, SQL, Java",html html nodejs linux sql jav
"JavaScript, MongoDB, Docker",javascript mongodp docker
"C#, CSS, JavaScript",css javascript
"Flask, Flutter, MongoDB",flask flutter mongodp
"JavaScript, ASP.NET, Docker, ASP.NET",javascript aspnet docker aspnet
"Next.js, Flask, Docker, C#, JavaScript",nextjs flask docker javascript
"Flask, Flutter, Java",flask flutter jav
"Python, Linux, Linux, Java, MongoDB, Java",python linux linux jav mongodp jav
"HTML, Azure, ASP.NET, Azure",html azure aspnet azure
"Linux, Flask, Next.js, C#",linux flask nextjs
"CSS, Linux, Azure",css linux azure
"Python, Django, Python",python django python
"Node.js, React, Next.js, Git",nodejs react nextjs git
"Git, Flask, JavaScript, React, Azure, Kubernetes",git flask javascript react azure kubernetes
"C#, ASP.NET, SQL, ASP.NET, Node.js",aspnet sql aspnet nodejs
"Git, C#, React, MongoDB, SQL",git react mongodp sql
"Azure, Java, Flutter",azure jav flutter
"Git, Next.js, ASP.NET, Java, CSS",git nextjs aspnet jav css
"Flutter, Kubernetes, Next.js, Flask",flutter kubernetes nextjs flask
"Linux, JavaScript, SQL, SQL, Django",linux javascript sql sql django
"HTML, Next.js, C#, Django",html nextjs django
"Next.js, Docker, C#",nextjs docker
"C#, C#, HTML, Git, SQL, Azure",html git sql azure
"Linux, Django, Next.js, Git",linux django nextjs git
"Django, C#, Git, HTML",django git html
"Flask, Python, JavaScript",flask python javascript
"Docker, Flutter, Kubernetes, CSS, Next.js",docker flutter kubernetes css nextjs
"Python, HTML, ASP.NET, Azure",python html aspnet azure
"Docker, C#, C#, React, Flutter, Azure",docker react flutter azure
"Next.js, JavaScript, Docker, Kubernetes, Kubernetes, Linux",nextjs javascript docker kubernetes kubernetes linux
"MongoDB, Git, C#, ASP.NET",mongodp git aspnet
"React, Python, Flutter",react python flutter
"MongoDB, SQL, CSS, Flutter",mongodp sql css flutter
"Node.js, Python, Node.js, Kubernetes, MongoDB",nodejs python nodejs kubernetes mongodp
"React, ASP.NET, Flutter, ASP.NET, Kubernetes",react aspnet flutter aspnet kubernetes
"Next.js, Kubernetes, SQL, Python",nextjs kubernetes sql python
"Linux, Flask, ASP.NET, MongoDB, C#",linux flask aspnet mongodp
"ASP.NET, CSS, Flask",aspnet css flask
"Django, C#, Django",django django
"C#, CSS, Git, CSS, Git",css git css git
"Flutter, Node.js, Kubernetes, Next.js",flutter nodejs kubernetes nextjs
"Docker, SQL, C#, Linux, Linux",docker sql linux linux
"SQL, Flutter, Java, CSS",sql flutter jav css
"Next.js, Git, CSS, Linux, Django, Git",nextjs git css linux django git
"Node.js, HTML, CSS, HTML, Django",nodejs html css html django
"SQL, HTML, Kubernetes, Python, Java, MongoDB",sql html kubernetes python jav mongodp
"Docker, MongoDB, Next.js",docker mongodp nextjs
"Linux, Flutter, Flask",linux flutter flask
"Azure, MongoDB, C#",azure mongodp
"Python, JavaScript, React",python javascript react
"ASP.NET, Kubernetes, Docker",aspnet kubernetes docker
"SQL, ASP.NET, SQL, ASP.NET, Node.js",sql aspnet sql aspnet nodejs
"Python, CSS, ASP.NET, MongoDB, C#",python css aspnet mongodp
"HTML, Linux, MongoDB, Kubernetes",html linux mongodp kubernetes
"Kubernetes, Docker, Linux, Kubernetes, Kubernetes",kubernetes docker linux kubernetes kubernetes
"Linux, ASP.NET, Flutter",linux aspnet flutter
"Linux, Kubernetes, Next.js, Flask, MongoDB",linux kubernetes nextjs flask mongodp
"Linux, MongoDB, C#, Python, Django",linux mongodp python django
"Kubernetes, Next.js, HTML, Node.js, MongoDB, HTML",kubernetes nextjs html nodejs mongodp html
"Flask, Linux, Next.js",flask linux nextjs
"Python, Docker, CSS, React, React",python docker css react react
"CSS, Flask, Kubernetes, MongoDB, Azure",css flask kubernetes mongodp azure
"React, CSS, JavaScript, Linux, Docker, Python",react css javascript linux docker python
"Linux, Docker, Flutter, React",linux docker flutter react
"Node.js, JavaScript, Java, SQL",nodejs javascript jav sql
"Azure, Django, C#, Azure, Azure",azure django azure azure
"Flutter, Docker, C#, SQL, Git, Flask",flutter docker sql git flask
"Linux, C#, CSS",linux css
"Next.js, Linux, ASP.NET, HTML",nextjs linux aspnet html
"Next.js, HTML, C#, Flask, SQL",nextjs html flask sql
"C#, Kubernetes, ASP.NET, ASP.NET, Linux",kubernetes aspnet aspnet linux
"ASP.NET, Next.js, Flutter, Python, Django, Kubernetes",aspnet nextjs flutter python django kubernetes
"Java, Flask, Node.js, CSS, Kubernetes",jav flask nodejs css kubernetes
"Linux, CSS, Flutter, Azure",linux css flutter azure
"Django, SQL, SQL, MongoDB",django sql sql mongodp
"Git, HTML, ASP.NET",git html aspnet
"Azure, Java, Linux, HTML, HTML",azure jav linux html html
"Git, Azure, Next.js, MongoDB, HTML, Azure",git azure nextjs mongodp html azure
"Java, Kubernetes, JavaScript, Python, Azure",jav kubernetes javascript python azure
"Azure, Docker, MongoDB, Git, Flutter",azure docker mongodp git flutter
"React, SQL, HTML, Docker",react sql html docker
"Flutter, Flask, Django",flutter flask django
"Docker, Linux, Azure, Java, CSS, C#",docker linux azure jav css
"Django, Node.js, Flask, Python, Linux",django nodejs flask python linux
"Next.js, Docker, Git, HTML, Java",nextjs docker git html jav
"C#, HTML, Linux, React, C#",html linux react
"HTML, Node.js, Java",html nodejs jav
"Docker, Git, Docker, Kubernetes, Docker",docker git docker kubernetes docker
"React, CSS, Git, Flutter, MongoDB, Next.js",react css git flutter mongodp nextjs
"Java, Flask, Docker",jav flask docker
"Node.js, Java, Python, Linux",nodejs jav python linux
"Docker, Node.js, Flutter",docker nodejs flutter
"JavaScript, Node.js, Azure, Next.js",javascript nodejs azure nextjs
"Azure, Flutter, Node.js",azure flutter nodejs
"Azure, HTML, Flask, C#",azure html flask
"Node.js, C#, Azure, C#, Next.js",nodejs azure nextjs
"Django, Java, Node.js, React",django jav nodejs react
"C#, JavaScript, Node.js",javascript nodejs
"SQL, Next.js, React",sql nextjs react
"Docker, HTML, Kubernetes, ASP.NET, MongoDB, Flutter",docker html kubernetes aspnet mongodp flutter
"Flutter, ASP.NET, React, Node.js",flutter aspnet react nodejs
"Next.js, C#, Azure",nextjs azure
"ASP.NET, Next.js, Flutter, Next.js, Flutter, React",aspnet nextjs flutter nextjs flutter react
"Flask, MongoDB, Azure, Next.js, Next.js",flask mongodp azure nextjs nextjs
"React, Java, Django",react jav django
"JavaScript, Kubernetes, Flask",javascript kubernetes flask
"ASP.NET, HTML, ASP.NET, CSS, Django",aspnet html aspnet css django
"SQL, Kubernetes, JavaScript, Linux, Python, Azure",sql kubernetes javascript linux python azure
"Flask, ASP.NET, Java, Java, React",flask aspnet jav jav react
"Kubernetes, MongoDB, CSS",kubernetes mongodp css
"HTML, React, Kubernetes, Azure, CSS, Azure",html react kubernetes azure css azure
"Flask, Kubernetes, Next.js, Docker, ASP.NET",flask kubernetes nextjs docker aspnet
"React, Kubernetes, Node.js",react kubernetes nodejs
"Git, Django, Linux, Flutter",git django linux flutter
"Flutter, Linux, Django",flutter linux django
"HTML, HTML, Git, Flutter, ASP.NET, C#",html html git flutter aspnet
"React, Linux, JavaScript, C#, Python",react linux javascript python
"Azure, Next.js, Flutter, SQL, Linux",azure nextjs flutter sql linux
"MongoDB, CSS, Flutter, C#",mongodp css flutter
"Flask, Python, Azure, Django, Flask",flask python azure django flask
"MongoDB, Node.js, Flutter",mongodp nodejs flutter
"C#, Azure, Linux, C#, Linux, React",azure linux linux react
"Python, CSS, Python, MongoDB, CSS, Git",python css python mongodp css git
"Django, Next.js, SQL",django nextjs sql
"Kubernetes, ASP.NET, Java",kubernetes aspnet jav
"HTML, Kubernetes, React, HTML",html kubernetes react html
"Kubernetes, Flutter, Azure, Java, Java",kubernetes flutter azure jav jav
"HTML, CSS, Docker, Node.js, Next.js",html css docker nodejs nextjs
"Next.js, Azure, Linux, Docker, Django",nextjs azure linux docker django
"HTML, Next.js, Azure, Flutter",html nextjs azure flutter
"ASP.NET, React, Python, Azure",aspnet react python azure
"Python, Azure, Flask, Docker",python azure flask docker
"CSS, HTML, SQL, ASP.NET, Kubernetes, Flutter",css html sql aspnet kubernetes flutter
"React, SQL, Docker, Linux, ASP.NET, SQL",react sql docker linux aspnet sql
"Azure, Linux, Kubernetes, CSS",azure linux kubernetes css
"Docker, Next.js, Node.js, Linux, Java, Kubernetes",docker nextjs nodejs linux jav kubernetes
"React, Node.js, C#",react nodejs
"Flask, HTML, Python",flask html python
"CSS, Docker, Java, Kubernetes, MongoDB",css docker jav kubernetes mongodp
"ASP.NET, Next.js, Linux, Docker, Flask, Kubernetes",aspnet nextjs linux docker flask kubernetes
"Kubernetes, CSS, Flask",kubernetes css flask
"Node.js, Git, Next.js, Python",nodejs git nextjs python
"CSS, Node.js, Docker",css nodejs docker
"SQL, ASP.NET, Node.js",sql aspnet nodejs
"MongoDB, ASP.NET, Python, Next.js, ASP.NET",mongodp aspnet python nextjs aspnet
"CSS, Linux, Flask",css linux flask
"Python, Git, Linux, HTML",python git linux html
"React, Kubernetes, ASP.NET, React, Java, Next.js",react kubernetes aspnet react jav nextjs
"Kubernetes, Python, Next.js, MongoDB, Linux, Python",kubernetes python nextjs mongodp linux python
"Next.js, Flask, Docker",nextjs flask docker
"Java, Java, HTML, Kubernetes",jav jav html kubernetes
"Python, C#, Git",python git
"Flutter, React, Kubernetes, Kubernetes",flutter react kubernetes kubernetes
"Flask, Git, Python, Linux, React",flask git python linux react
"Next.js, HTML, Flutter, Java, Kubernetes",nextjs html flutter jav kubernetes
"Docker, Flutter, C#, HTML, Linux",docker flutter html linux
"Docker, SQL, Kubernetes, React",docker sql kubernetes react
"Node.js, JavaScript, Git",nodejs javascript git
"Flask, Node.js, Git, Java, Git, Linux",flask nodejs git jav git linux
"Java, Linux, Linux",jav linux linux
"Node.js, Kubernetes, JavaScript, Django, ASP.NET, Node.js",nodejs kubernetes javascript django aspnet nodejs
"Linux, SQL, HTML",linux sql html
"SQL, Next.js, Docker",sql nextjs docker
"Git, Flask, Git, Linux",git flask git linux
"Azure, JavaScript, CSS, C#, Python, Next.js",azure javascript css python nextjs
"Next.js, Next.js, Django",nextjs nextjs django
"React, Azure, C#, JavaScript, React, JavaScript",react azure javascript react javascript
"Flask, Java, JavaScript, Java, SQL, Flask",flask jav javascript jav sql flask
"Kubernetes, React, React, Java",kubernetes react react jav
"Python, Flask, Azure, Docker, MongoDB, Kubernetes",python flask azure docker mongodp kubernetes
"Java, JavaScript, CSS",jav javascript css
"React, React, Docker, Python, C#",react react docker python
"Node.js, CSS, Kubernetes",nodejs css kubernetes
"Linux, Git, HTML",linux git html
"Next.js, MongoDB, Django",nextjs mongodp django
"Flutter, Kubernetes, HTML, MongoDB, Docker, Linux",flutter kubernetes html mongodp docker linux
"CSS, Python, Node.js, JavaScript",css python nodejs javascript
"Docker, Docker, Docker",docker docker docker
"Java, HTML, Git, CSS, Linux",jav html git css linux
"CSS, Java, Azure, Node.js, MongoDB",css jav azure nodejs mongodp
"Next.js, Django, Docker, Next.js",nextjs django docker nextjs
"Node.js, Azure, C#, Linux, MongoDB, Node.js",nodejs azure linux mongodp nodejs
"SQL, Flask, Java",sql flask jav
"MongoDB, Java, Flask, Next.js, Kubernetes",mongodp jav flask nextjs kubernetes
"React, HTML, Azure",react html azure
"React, C#, Flask, C#, Flask",react flask flask
"Linux, C#, Flask",linux flask
"Kubernetes, Kubernetes, HTML, HTML, React",kubernetes kubernetes html html react
"HTML, Git, React, ASP.NET",html git react aspnet
"SQL, Java, Node.js, SQL, Next.js, HTML",sql jav nodejs sql nextjs html
"SQL, Kubernetes, Docker, CSS",sql kubernetes docker css
"Git, Flask, CSS, Kubernetes, Kubernetes, Next.js",git flask css kubernetes kubernetes nextjs
"Azure, ASP.NET, Docker, JavaScript, Kubernetes, Git",azure aspnet docker javascript kubernetes git
"Next.js, Kubernetes, MongoDB, Git",nextjs kubernetes mongodp git
"C#, Kubernetes, Flask, Git",kubernetes flask git
"SQL, Flask, Flutter, ASP.NET, Flutter, C#",sql flask flutter aspnet flutter
"React, Linux, Kubernetes, C#, JavaScript",react linux kubernetes javascript
"Flask, HTML, Django",flask html django
"Django, Flask, MongoDB",django flask mongodp
"Flutter, Flask, C#",flutter flask
"Node.js, HTML, MongoDB",nodejs html mongodp
"Django, Docker, HTML, React, React",django docker html react react
"CSS, SQL, Linux, Flutter",css sql linux flutter
"Django, Python, Flutter, CSS, Docker",django python flutter css docker
"React, ASP.NET, MongoDB, Git, Kubernetes, Flask",react aspnet mongodp git kubernetes flask
"MongoDB, ASP.NET, Flask, Flutter",mongodp aspnet flask flutter
"SQL, CSS, React, Flask, ASP.NET",sql css react flask aspnet
"React, Docker, JavaScript",react docker javascript
"Django, CSS, JavaScript, Flutter, SQL",django css javascript flutter sql
"Docker, React, HTML, Docker, Next.js, Django",docker react html docker nextjs django
"Docker, CSS, Docker",docker css docker
"Python, SQL, Kubernetes, Flask, Next.js",python sql kubernetes flask nextjs
"Python, React, MongoDB, Node.js",python react mongodp nodejs
"Docker, HTML, Node.js",docker html nodejs
"SQL, React, Kubernetes",sql react kubernetes
"Flask, Kubernetes, ASP.NET, Azure, Next.js",flask kubernetes aspnet azure nextjs
"Git, Python, ASP.NET",git python aspnet
"Next.js, C#, Flask",nextjs flask
"Kubernetes, Flutter, Flask, Django",kubernetes flutter flask django
"ASP.NET, React, Node.js, JavaScript",aspnet react nodejs javascript
"React, Java, CSS, ASP.NET",react jav css aspnet
"CSS, ASP.NET, Docker",css aspnet docker
"ASP.NET, Node.js, MongoDB, Azure, SQL, Flutter",aspnet nodejs mongodp azure sql flutter
"Linux, MongoDB, Azure, MongoDB",linux mongodp azure mongodp
"Next.js, Linux, C#, Django, C#",nextjs linux django
"MongoDB, Azure, MongoDB, React, Flutter",mongodp azure mongodp react flutter
"CSS, MongoDB, Flask, C#",css mongodp flask
"Azure, ASP.NET, Flutter, Node.js, React",azure aspnet flutter nodejs react
"Git, Kubernetes, React",git kubernetes react
"React, Flutter, JavaScript, Java",react flutter javascript jav
